"","x"
"1","covid question from clients what should my company do if an employee tests negative for covid but has textbook sym…"
"2","travel update
from am on mondayjanuaryyou must have proof of a negative coronavirus covid test to…"
"3","somebody gotta give the shots butof those folks are caring for the recordof hospitalized co…"
"4","yesyesyesyesyesyesyesyes
if you followon twitter you know his wonkiness for all things health care…"
"5","sign up for our newsletter atto learn when and how to receive the covid vaccine…"
"6","apparently it’s going to be deep cleaned and repainted covid was in there and so were the trumps ugh"
"7","biden to raise federal minimum wage toan hour in t covid relief plan"
"8","biden lays outtrillion covid relief package withstimulus checks"
"9","we shouldn’t do anything apparently covid is the cure for everything else even old ag…"
"10","i was born in orange county california anaheim on october nd
i was young…"
"11","get in the know tustin covid vaccine townhall tonight"
"12","was he really sick he just had to have covid pneumonia not the normal one he is dramatic with his histor…"
"13","i know i was paying attention to the early covid videos being leaked out of china…"
"14","what they said about lockdowns before"
"15","covid virus avoids asymptomatic idiots"
"16","honestly this was me pre covid"
"17","ok heresa tip i go to the wet section wipe the bag on the cucumbers or parsly and then its eas…"
"18","and the chinese communist party knew nothing about covid and alerted the who as soon as it found out"
"19","i just want to make out with someone hahaha i hate covid"
"20","many diversity visa immigrants are working on producingdelivering food to americans during covid 
dv…"
"21","bidenstrillion covid relief plan calls for stimulus checks unemployment support and more…"
"22","biden urges focus on covid and economy as trump trial looms"
"23","while record cases of covid and deaths in his state occur everyday hes off to a political fund ra…"
"24","not only that he knew he had covid at the time i really hope they di…"
"25","i want to preorder the newpokemonsnap as a cartridge copy but i also am concerned about covid especia…"
"26","regulator refuses to approve mass daily covid testing at english schoolscoronavirus"
"27","i got happy when he got covid"
"28","many diversity visa immigrants are working on producingdelivering food to americans during covi…"
"29","nysi stochastics crossed abovetoday doing so has led to continuation of trend for multiple weeksout ofti…"
"30","gigs and covid
as the effect of covid riseswe regret to inform the general public that our entertainers will…"
"31","looking forward to hearing the crowd reaction the next time you ever appear in public or better yet may…"
"32","he might be right but remember covid is good for moderna share price"
"33","deans list during a covid semester should count twice congrats"
"34","i am fully convinced that these movie productions were still going on during the peak of covid because there is toooooooo much content out"
"35","meanwhile something else in us is also in high gear covid the country is flooded with virus with …"
"36","when covid is “over” i will be renting out a cabin in gatlinburg with my best friends and their friends and we are…"
"37","work for home to avoid covidearnweekly without sending money to anyone ask me how or inbox me directly"
"38","wcsd looks for volunteers to help immunize thousands of employees"
"39","usually emails from school are about covid tonight it’s a blizzard next week grasshoppers"
"40","seriously stop going to these these states are reporting record covid cases daily and hospitals are at capacity…"
"41","well i do not like hypothetical situations but saying covid made zero…"
"42","disney during a pandemic yeah we will keep it open we like money 
people go to disneyland and spread covid thr…"
"43","new connect care bytesblog postingcovid and connect careaccessing public health act forms"
"44","she took covid vaccine a week ago she is from us and a very real person
god 
<U+0001F631><U+0001F631><U+0001F97A><U+0001F97A>"
"45","couldn’t agree more i have been out of work since april due to covid"
"46","i need to know if covid is planning on going away anytime soon"
"47","i also write to random folks on facebook insta linkedin stocktwitsim retired an…"
"48","sep stday virus mimicked covid tested twice negative still ran a fever diagnosed with acute…"
"49","colorado covid cases increase todeaths tocolorado ncovrecombinomics inc"
"50","covid rahh <U+0001F629><U+0001F62D> god has hidden us from this deadly pestilence amp we should just be thanking him nothing to quarrel ab…"
"51","why soon as i drank that soda from mc donald’s my stomach started hurting and i had to go to the bathroom do i see…"
"52","watching dc become a fortress i feel bad that joe biden and kamala harris will not be able to celebrate their inaug…"
"53","jokes radiocanada head travelled to florida despite federal travel advisory"
"54","postcovid lungs worse than the worst smokers lungs surgeon sayscbs news"
"55","some a dem elderly people ya no fraid a covid or a done dem just done wid life"
"56","then covid became serious in early march and thens when i had to chill lol <U+0001F62D>"
"57","covid infection gives some immunity but virus can still be spread study findsreuters"
"58","california department of public health"
"59","nearly a year ago trump sent a mercy ship and you reneged
sending covid patients into
nursing homes pusshead…"
"60","welp after completely emotionally wrecking my sixyearold by letting her watch the phantom of the opera were all…"
"61","biden lays outtrillion covid relief package withstimulus checks"
"62","id guess three days if it ties in with a covid test but"
"63","did you lost this much quantum of soldiers in any war yetchina has killedmore thanyouramericans by…"
"64","daily updatesus 

casesk lwk
day avglw 

deathslw …"
"65","i wanna go to the mountains for my bday<U+0001F97A>
if y’all have ever stayed in a nice cabin send me that link i won’t be…"
"66","how has covid changed the payment sector the pandemic has significantly accelerated the shift towards digital pa…"
"67","friend commented a few weeks ago wed be benefitting for decades from the knowledge gained with the…"
"68","was telling my mom i might drop off my grandma a meal or something cause covid and she told me that my grandmother…"
"69","another u turn arriving soon"
"70","see the appointment is for you not for covid so it can’t come in"
"71","out of the abundance of caution we will be closed friday and saturday as an employee has been exposed to a covid…"
"72","anyone thinking that wearing a mask will keep them from getting covid is medically ignorant"
"73","trillion is about to be spent in the usa on a covid relief package that will pay for itself once the economy p…"
"74","governor hogan announces expansion of covid vaccine eligibility for marylandersand over



maryland"
"75","all little kids still only call covid “the coronavirus” and they’re right and they should say it"
"76","if you’regoing out in the public you’re definitely going to catch “covid”it’s just is what it is"
"77","trump and his administration avoided a recession by driving the deficit to record high…"
"78","the covid death toll is even worse than it looksthe wall street journal"
"79","come and see kitakolas live in bigolive dealing with covid"
"80","more covid perspectives from our nation’s manufacturers as moderated by omi’s ned hill"
"81","its starting to look like the quality trumps coup attempt is on par with
his courtroom challenges of the electio…"
"82","i actually am for more worried about kelce than hill this is baring any major covid issues with ward"
"83","atshe is the defiant editor of ‘the buzz’"
"84","hey all any unused covid shots not being used let me know and i will be there"
"85","its a little imprudent to share it in the situation of emergency in japan but despite the difficulty we have cre…"
"86","anazing how theyve decided this yet all the players that have been caught breaking the covid rules havent…"
"87","to put it bluntly fucking get your fucking shots you fucking fucks"
"88","may the lord stretch his healing hands on anyone that is sick or have contacted covid and make them whole in je…"
"89","i just read an obituary that specified the decedent did not die from covid <U+0001F602>in a nutshell"
"90","couldn’t remember which number comes after covid lol"
"91","work for home to avoid covidearnweekly without sending money to anyone ask me how or inbox me directly"
"92","still going to the grocery store with new virus variants spreading it’s probably time to stop"
"93","my heartburn is out if control also my husband just had a rapid covid test that came back positive fun times"
"94","ralph’s doesn’t even provide covid as a vaccine option in its reg…"
"95","so does heb have like their own version of the covid vaccine like wild red compared to big red cause sometimes wi…"
"96","joe biden wantstrillion in new covid relief"
"97","covid has never been isolated so why do you insist on disinformation and misinformation fear mongering…"
"98","i think its the covid and the coupvid"
"99","agreed i was born so premature i have problems in every system covid might be a mercy killing"
"100","wish i had covid when i was eating her out so i couldn’t smell or taste jay that nasty shit <U+0001F923><U+0001F923><U+0001F923>"
"101","…"
"102","k died of covid while no one died from the flu lol covid only killed the flu and pneumoniascamdemic"
"103","covid update the town of newmarket will reopen all outdoor skating community rinks and allow tobogganing on fr…"
"104","it is related because it’s been proven that obese people a…"
"105","bloody hell there had to be a covid variant from brazil another twist in this neverending pandemic"
"106","no dumbass those millions of de…"
"107","was just going to do an update on the return of local sports and per usual on this topic down the rabbit hole i w…"
"108","this is what they meant when they said lady gaga concert tickets are as hard to get as the covid vaccine"
"109","bout to have chinese food for first time since covid<U+0001F62C>"
"110","biden unveils the ‘american rescue plan’ includingstimulus checks various other relief intrillion co…"
"111","u sure it was covid"
"112","pts admitted with covid claiming no sick contacts but clearly they did familycaregiver gets tested because of clo…"
"113","i think pretending to have covid would cause you more of a headache than just going to the dentist at t…"
"114","my perspective we werent going to have a normal inauguration anyway thanks to covid and in a way and i truly h…"
"115","biden lays outtrillion covid relief package withstimulus checks"
"116","’s failed obamapolicies will tank our economy he won’t even need a covid pandemic it’s gonna be…"
"117","queenslanders have been enthusiastically learning about their familyhistory in covid lockdown withspike…"
"118","been out of workweeks because i got covid definitely not rolling in cash right now"
"119","some wre going to die for lack of beds
just not covid either
any emergency 
that survivable heart attack or car acc…"
"120","covid deaths are the highest they’ve ever been — and the more infectious variants could make"
"121","as if covid only attacks labelsguess when you have a bulb of air on a set of shoulders you shouldnt expect an…"
"122","so glad dr henry pushed back against the suggestion that porters in hospitals are not at high risk of covid amp shld…"
"123","some insight into californias covid<U+30FC> hospital bed shortage bythe healthcare system in californ…"
"124","excluding the covid anxious times i found calgary friendlier than…"
"125","my mom posted this on her ig and i’m sorry but i’m dying laughing rnshe titled it “covid vaccine effects” okay…"
"126","covid vaccination speed in europe"
"127","maybe they should try applying for something useful like housekeeping for a hospital’s covid ward"
"128","trying to make the most of this covid seasonour high school robotics teamis developing a brand new ga…"
"129","bidens covid plan to include billions for vaccine distribution schoolsbiden transition updates"
"130","i can’t wait to go clothes shopping postcovid because i have no idea what size i am in anything anymore"
"131","richmond city councilwoman voices hesitancy about covid vaccine health experts address skepticism in us…"
"132","joe biden just released histrillion covid relief plan – heres whats in itlet’s just start paying w…"
"133","news is like “ inpeople in la has covid you’re about to hitmillion cases hospitals arecapacity yo…"
"134","why is it that a lot of the symptoms for dka match with covid cause i got one of them"
"135","this is the first time ive heard saskatchewans top doctor entertain the possibility of a fullon lockdown since s…"
"136","if ni start to ramp things up even further i think its more than doable to vaccinate ever…"
"137","no a johns hopkins student site published a newsletter that falsely claim…"
"138","interesting article about corporations have been the biggest influence on the government during covid"
"139","in this covid times where shifts are mad sm after a long shift drove back that long to show me the way this late…"
"140","honestly not mad at my covid birthday so low key and chill <U+0001F60C>"
"141","why does she command such massive supportshe’s a liaris mired in corru…"
"142","see how the vaccine rollout is going in your state"
"143","so i just watched someone do a covid test and violently gaggedand my family say i dont have sensory issues <U+0001F602>"
"144","lethbridge showsnew cases of covidactive case count increases bytowestsidesouthsidenor…"
"145","s covid relief proposal for education

—b for k schools
—b for higher ed
—b for governors…"
"146","investigating outbreaks helps us understand the impact of covid in kingcounty view updated outbreak data now a…"
"147","oh ill try to save since my birthday is indays but hardly anyone remembers especial…"
"148","biden to unveiltrillion covid relief plan includingstimulus checksnpr <U+2066><U+2069> <U+2066>…"
"149","imagine the girls in my house think its okay to throw a celebration during a pandemic and lockdown idgaf if they…"
"150","covid poses no more of a threat to children than a common cold <U+0001F644>"
"151","my medical professional peers and my man who’s a firefighter paramedic have told me that if you have high blood pre…"
"152","biden lays outtrillion covid relief package withstimulus checks"
"153","bill for covid

they’re mocking you 

don’t forget thosehijackersyears before the pandemic<U+0001F602><U+0001F602><U+0001F602>"
"154","thanks guys you two singlehandedly caused covid heroes my ass"
"155","please fumigate the white house before joe and kamala move in there is so much covid in that place that it needs to be fumigated"
"156","theres an ongoing concern amongst a lot of health professionals that the government isnt acting on the possibili…"
"157","looks like the government did not get to publish the covid stats today what does it achieve in delaying them unle…"
"158","it would be in biden’s best interest to ask for more thantrillion because someone will need money to handle th…"
"159","and who caused thisyea rightjust like covidyour king of disaster"
"160","for the recordas covid cases and deaths continue to climb in the us the pandemic of misinf…"
"161","whats that supposed to even mean youre slandering…"
"162","my mother who has diabetes contracted covid from her workplace and before we all knew it the rest of the household…"
"163","anne hathaway races to release locked down covid romcom"
"164","i think it is time for the federal government to takeover all covid responsibility except for the…"
"165","except that if you look at ons data based on death certificates overha…"
"166","in your articleyou’re inaccurate in stating “apart from weekall ca…"
"167","covid uk coronavirus deaths rise bywithnew casesuk newssky news"
"168","this former banking executive wanted to help a friend suffering from lupus now he leads a biotech company on the v…"
"169","hand sanitizer is available throughout the buildings schools have not closed for covid ca…"
"170","just another day absolutely enthralled by the inexhaustible variety of covid life <U+0001F643>"
"171","comment from the superintendent suggesting covid has resulted in increased violence out of school while i…"
"172","great article"
"173","federal data shows san diego county had the fourth most coronavirus cases and deaths in the past week compared to a…"
"174","i cant keep doing this doctor pleads for review of data during covid"
"175","if the bus had too many passengers as it pertains to covid limitations they may have switched to runn…"
"176","icymi despite aincrease in manufacturing jobs since the covid outbreak we know people across ontario…"
"177","though it’s not concrete evidence of the covid vaccine’s effectiveness the data shows a sharp drop in the numbe…"
"178","i have to travel this year to make up for last year so covid need to ahead and dismiss itself"
"179","andhave each received limited amounts of the covid vaccine and each will be…"
"180","immune people can carry the virus despite being having no symptoms and infect other people savedyouaclick"
"181","no more disgusting than the trump name linked to sedition k covid deaths and two impeachment’s…"
"182","saturdays nc state v georgia tech game has been postponed due to positive covid test within nc state program"
"183","previously the students in these rural communities traveled long distances from their homes to schools located in n…"
"184","i would love to know why giant floating hospitals were brought into ny harbor for covid sent by t…"
"185","goodi’d like to get the answer too i think i’ll use the logic of…"
"186","covid is real y’all stay yall tails homebruhlike this ain’t no joke"
"187","minute maid park to serve as vaccination mega site by appointment only"
"188","let’s start something elise wants to go after cuomo when he’s done so good let’s thank him thankyoucuomo for se…"
"189","no we live in a country that spread covidlike butter so we now have to suffer the consequences for it"
"190","what ri towns have the highest rate of covid deaths hospitalizations and cases"
"191","postcovid lungs worse than the worst smokers lungs surgeon sayscbs news"
"192","hinshaw says those businesses had to be included in dec closures to reduce the contact between albertans said that…"
"193","relationships in covid s u c k s"
"194","rightwingers blood drinking satanist bill gates soros blm one word government g agendaob…"
"195","mibmiziki nowplaying collectif des artistesstop covid"
"196","would you or someone in your team be interested in discussing helping proliferate play…"
"197","i need to find a homeschooler because i just know this covid vaccine is about to be required for kids in school"
"198","build your faith in god’s words and take necessary precautions no covid will come nigh your dwelling place in jesus name"
"199","for the recordas covid cases and deaths continue to climb in the us the pandemic of misin…"
"200","biden to announcechecks and national vaccination program as part oftrillion covidrelief plan"
"201","well george a journalist at todays covid briefing asked her to carry on with these dai…"
"202","exactly shes a female sikora shes found a way to monetize covid denial thr…"
"203","<U+26A0><U+FE0F> free online emergency preparedness training

the covid pandemic challenged the delivery of local preparednes…"
"204","ironically i caught covid one year ago yesterday at the javits center"
"205","my condolences to the friends families and communities of thealbertans we have lost today to covid covidab covid"
"206","dr shahab may advise the government to bring down a hammer of new public health measures if the province’s unsustai…"
"207","meth is a preventative for covid everything is fine"
"208","i live in california where fast food is more essential than schoolso my teenager got covid at…"
"209","we are hanging in there my wife and i caught the covid we are fighters but the want us to do this infus…"
"210","i know a few people got covid here in orange county"
"211","aftermonths of delaydenial i got iv crohn’s med today i made ceo alex gorsky richer his net worth ismil…"
"212","uk is readying itself to use the drug interferon beta to fight covid in hospitalised patients…"
"213","oh new jersey"
"214","she took covid vaccine a week ago she is from uk and a very real person
god 
<U+0001F631><U+0001F631><U+0001F97A><U+0001F97A>"
"215","as we host tonight’s rrcouncil meeting both inperson and virtually to adhere to social distancing protocols relat…"
"216","covid <U+0001F440>"
"217","right covid is cured yaallcome on back to work"
"218","death from covid"
"219","our city had the st covid outbreak on the east coast
we flattened the curve and went all the way down tocases…"
"220","people who recover from covid have been reinfectedso you’re wrong"
"221","your store on new market in va is so dirty that im worried i will catch covid there now you wan…"
"222","oan and fox news are the enabler of deaths whether it be from climate change covid or ins…"
"223","i really wish covid would just go away…"
"224","oh well what if covid gets her"
"225","giletsjaunes <U+0001F621> <U+0001F637> insupportable <U+0001F91C>"
"226","yo any recs for little covidfriendly rentals driving distance from dc eg cabins etc wifi optional this is for relaxation purposes"
"227","were back baby
new venue new nights new covid safe plan
head to fb insta or team app for all the details…"
"228","son possibly dropping tonight

i guess i’ll be pulling the trigger on son gtgt kdb amp hoping that no more covid nonse…"
"229","what’s the black market for covid vaccines looking like i’d pay likeextra"
"230","got my first pfizer covidvaccine dose"
"231","was given a chance and chose not to fuck that
the venn diagram of people who dont think covid is rea…"
"232","got my first dose covid vaccine today feeling good about this choice i hope everyone gets the vaccine save lives"
"233","feeling like shit want covid gone so i can get coked up at parties again"
"234","upset about parler huh have you talked to your ag about the insurrection bet you dont give a sh…"
"235","this is the exact point i tried to make to a friend i met while dogwalking this afternoon lockdowns may help when…"
"236","i would contact the labor board since you should be protected under the fmla act since your wife had covid"
"237","aboutpeople a day are dying of covid in the us many say that’s an underestimate those deaths are avoidab…"
"238","covid tory mp warns boris johnson his leadership could be on the tablebut swiftly backs downsky news"
"239","i dont get the being exempt during the war nobody felt the need to be exempt from wearing a gas…"
"240","baba covid by the name sefe be like horror filmna scape goat diseaseother o…"
"241","i pray my dad beats this covid idem manfuck man"
"242","is this the very same quarantine service that has left all covidquarantine decisions up to the states…"
"243","are watching every professional who speaks up for long covid patients desperately hoping they wil…"
"244","tax the rich dammitprogressives are pushing for progressive tax increases to address covidrelated funding g…"
"245","how are the covid symptoms today"
"246","if he wasn’t party to the fraud those soldiers would be home safe with their families i pray…"
"247","for the recordas covid cases and deaths continue to climb in the us the pandemic of mis…"
"248","imagine that an actual fucking plan"
"249","entering phaseupdate pfizer has been approved by philippine fda as ofkindly read this link<U+0001F447><U+0001F3FB>…"
"250","here are some great resources re covid from the maricopa democraticparty of arizona"
"251","nh peopleand older can register for covid vaccine next week"
"252","icymi vfl shazzon bradley joinedandon sportstalk to talk about his battle with covi…"
"253","this won’t help anything but anything to push for covid numbers to go up so you can feel in control to…"
"254","every person should geta month not because of covid just because its a good system that helps people and…"
"255","a little surprised by the move now as clubs probably will spend more this summer assuming covid is un…"
"256","after seeing his meeting with civil rights leaders not surprised and seems that joe biden will make minorities an…"
"257","i wonder what arthur b sleigh would think of his newspaperyears on"
"258","fuck cancer fuck covid and fuck the government <U+203C><U+FE0F>"
"259","i blame covid brain for the falling joke i just didnt want to share a screenshot of my tax amp bank info<U+0001F602>"
"260","you must readthis
doctor’s death after covid vaccine is being investigated"
"261","latino black children twice as likely to endure multiple covidrelated hardships"
"262","walmart temporarily closes a store in long beach for covid sanitizing"
"263","covid measures also suppress flu—for now"
"264","side  i just read a really interesting article about using the covid vaccines mrna technology for c…"
"265","my intrusive thought of the day is someone with covid spit in my food"
