"","x"
"535","opinion why we’re not doing better on covid vaccines"
"536","finally some numbers behind my concern how many excess deaths have occurred because of lack of resources related t…"
"537","for everyone 

unreported truths about covid and lockdowns partintroduction and death counts and estimates"
"538","no no nohitler was completely on top of covidhe realized early on that having…"
"539","taiwan’s handling is pure luck and a joke china banned group tour to taiwan a few months ahead of c…"
"540","the only time you cover children is when they’ve been affected by trump schools are reopening during t…"
"541","so much love and respect for these brave folks these are the kind of risktakers we need the ecological emergency…"
"542","mil new covid cases and k deaths since january st and were supposed to go back to “normal” this year i just…"
"543","the first death from covid in china for eight months today source sky news apparently they say the virus there i…"
"544","however nsw health currently recommends delaying nonessential travel within nsw especially between gre…"
"545","niggas out here being safe and still gettin covid<U+0001F644><U+0001F644><U+0001F644><U+0001F644> is mei’m niggas"
"546","covid"
"547","this covid vaccine art has some nft potential"
"548","my argument is lockdowns are not effective…"
"549","mycolumn on why thesitcom mrmayor isnt all that funnynot a lot of comedy to be mined in…"
"550","help slow the spread of covid and identify at risk cases sooner by selfreporting your symptoms daily even if y…"
"551","i’m with you renee seeing how everybody lives is one…"
"552","i thought “running covid patients on the dry side” had been abandoned soon af…"
"553","its pretty ins…"
"554","designated transportation for covidpositive people"
"555","shout out to board member dr chandra varia

thank you for sharing you chose to take the covid vaccination

she s…"
"556","yesterday i posted the video of this woman who was shaking uncontrollability after taking moderna vaccine
it wen…"
"557","like covid surge didnt do it for la so now they are trying extreme covid surge i feel like you can say extr…"
"558","shrinking economy due to covid amp tensions with tr amp rapidly aging population it is a economical su…"
"559","covid has created momentum for expanding telemedicine and scopes of practice in arkansas arkleg legislators sa…"
"560","parents who have kids doing school from home has covid killed common core math yet <U+0001F91E><U+0001F3FB> commoncore homeschooling"
"561","the coronavirus is erasing minority women from the workforce"
"562","selfemployed dont get wages i should know i am one and i have had zero covid financial support…"
"563","because was many tombs
so
these aborts of i call you
need covid in the ass
no disco
what disco pls
o…"
"564","fordays i will post a picture from a day in the life of an educator prior to covid i will post without explana…"
"565","alberta covid deaths by ages
 years no deaths
 years five deaths
 years seven deaths
…"
"566","thx brian for a great thread i hope some reporters pick up on it avi nath at nih told me recently…"
"567","is it safe to eat chickenwings yet"
"568","yeah i got it only cuz i was doing uber amp lyft and passing by it literally ever day that i was driv…"
"569","bruh everybody but likepeople on the heat in covid protocol"
"570","what theyoure the sweetest i hope we can hang out when covid ends i miss you thank you so much beautiful <U+0001F496>"
"571","i really don’t get it when people say alhamdulillah or padan muka to those who’re infected by covid it’s someth…"
"572","plan for the biden clan
<U+0001F30D><U+0001F476><U+0001F467><U+0001F9D4><U+0001F3FD><U+0001F468><U+200D><U+0001F9B0><U+0001F469><U+0001F3FC><U+200D><U+0001F9B2><U+0001F469><U+0001F3FD><U+0001F468><U+0001F3FF><U+200D><U+0001F393><U+0001F468><U+200D><U+0001F373><U+0001F468><U+0001F3FD><U+200D><U+0001F527><U+0001F9D5><U+0001F575><U+0001F3FD><U+200D><U+2642><U+FE0F>
<U+0001F321>vaccines 
<U+0001F6D1>tax credit increase
<U+0001F5FD>more stimulus to lowall…"
"573","you know whats a bigger hoax than covidcovid vaccine
people being told w th vaccine they could see their fa…"
"574","a wall street journal analysis finds the covid death toll is being seriously undercounted

the us had more th…"
"575","don’t forget what else trump has donereignited decades old racial tensions screwed up covid resp…"
"576","ministerandthere may be some people who want some clarity on covid vaccine distribu…"
"577","when u just spent a ton of time filling out the addendum form on how covid has affected ur worklife for ur faculty…"
"578","we’ve locked down x and people are still being denied critical care not good enough…"
"579","so have you had covid or anything besides covid this year if the answer is no which i…"
"580","which is dangerous of course but my risk of severe complications or death from covid seem to be estimated atin…"
"581","<U+0001F534>portuguese health workerdies two days after getting pfizer jab"
"582","wants to open barsrestaurants we say no if you do covid rates will go up and ctu will use it…"
"583","so black beetle juice wants to open the bars and restaurants asap

trump cured covid by leaving office confirmed"
"584","it is sad to see the decision particularly knowing birds are not known to be carriers of sarscovid"
"585","the extra deaths in victoria were falsely classifieddiagnosed as covid to justify the extended loc…"
"586","listen jim lofgren talks about a plan presented to the sac county board of supervisors that would provide new fina…"
"587","i feel like my voice is getting deeper like i don’t sound the same ever since my birthday not sick not covid just getting old <U+0001F974>"
"588","had some practice for my covid vaccine yesterday flu shot plus tetanus shot my arms are sore"
"589","hopefully they will extend business rates holiday too
i am extremely concerned about this time next y…"
"590","there are at least four bills in the legislature aimed at limiting the governors emergency powers however little…"
"591","covid in the office the zombie dragon has melted the ice wall the north is overrun"
"592","in final transition days biden team gets access to critical covid vaccine data"
"593","after using the excuse of covid to wreck the economy there will be no such thing as retirement 

or savings

o…"
"594","footballers criticised as brainless for hugging in goal celebrations amid covidthats always the trouble with g…"
"595","data from the state this week showed some counties in our area have usedpercent or less of their allocated firs…"
"596","rice purity test but you check off all the things you did that were not covid safe"
"597","a thanksgiving tweet below from andy slavitt who biden just appointed to his covid team…"
"598","phe said although those with antibodies are unlikely to become ill again with covid early evidence from the nex…"
"599","here is my imitial reponse
 rally size does not equal prop…"
"600","hey covid go with your daddy next week he leaves noon on wednesday
so long"
"601","arrested clubber tests positive to covid in police cell"
"602","when are you going to get your employees on the vaccination list should be a priority since they g…"
"603","will covid lead to mecfs if a wave of new cases that doubles the number of americans with mecfs is about to…"
"604","reading between the lines a little bit is this the second time rickys had covid"
"605","he is accountable for his choiceshe must pay his debt to society deutsche amp putin

covid deaths amp…"
"606","why don’t you take the keys and lock up your towninhave covid and you’re complaining about everywhere else"
"607","my uncle died from covid

he retired from the post officeyears ago his mother lived to beand his father…"
"608","this is really disgusting amp unacceptable get him back to his family temporarily get him vaccinated bbc…"
"609","dr bonnie henry announced thursday that health officials are investigating how the person in bc contracted the v…"
"610","i have no interest in covid related memorabilia but i do like these two a lot"
"611","‘to get started on the finish line’ yearold has been waiting for opportunity to get covid vaccine"
"612","its fantastic that thai police now finding illegal gambling dens everywhere in thailand <U+0001F440> and yet only a few wee…"
"613","bidenstrillion covid relief plan calls for stimulus checks unemployment support and more"
"614","covid or not i would be spending founders day in the house"
"615","uk covid update more thandeaths for rd day in a row

 new cases 
 in hospital
 in…"
"616","wow bidens covid plan costs onlydang i didnt know i could end covid usin barelybucks"
"617","that kind of thinking is very ignorant why should they not cry bec…"
"618","ive been blessed to have survivedhealthy but ive had my heart broken hearing about friends t…"
"619","im hungry and cant afford my rent or electric services covid is killing me slowly painfully will i live another day"
"620","data normalization is important i madecharts with the same data different takeaways a surprising find some l…"
"621","yea signing autographs while the game is still playing several covid inf…"
"622","covid brazil hospitals run out of oxygen for virus patientsbbc news"
"623","everytime someone get covid y’all say covid is real like we haven’t been in a damn pandemic since last march"
"624","you also seem to be implying that the covid death toll in the us would be significantly…"
"625","having my nd covid jab next week"
"626","when i had covid i lost my taste and smell so i stopped eating and i lost so much weight i hate it"
"627","really frighteningup fromyesterdaythe day before covid cases in glasgow 
covid"
"628","if you look at my tweetsi’m not worried about covid or “lockdowns” or freedoms and neither do i me…"
"629","yup example"
"630","although peopleand older are now eligible to register to receive covid vaccinations contra costa health ser…"
"631","news cancer screening tests cancer diagnoses during covid pandemic"
"632","woman suffers whole body convulsions after taking experimental moderna covid vaccine"
"633","teachers could start being vaccinated for covid as early as late feb but most will likely get their first dose…"
"634","forbes article
made from monkey dna
<U+FFFC>
<U+FFFC>

the astrazenecaoxford vaccine is a chimpanzee adenovirusvectored…"
"635","want to see some hoops get your free covid test and drop the positivity rate 
testing here"
"636","gotta stop taking my mask off when im doing the dishes before i catch this covid <U+0001F926><U+0001F3FE><U+200D><U+2642><U+FE0F>"
"637","woman suffers whole body convulsions after taking experimental moderna covid vaccine"
"638","just checking my local covid dashboarddied km radius of my front door today <U+0001F62C>"
"639","yesthere’s an hisd covid dashboard that counts cases of student and staffthey still keep addin…"
"640","educators in abq tell me theyre hopeful the covid vaccine will aid school reopen plans in newmexico and that…"
"641","biden lays outtrillion covid relief package withstimulus checks"
"642","i tried to initially give trump the benefit of the doubt when he first went into office i really did…"
"643","more pregnant women are being treated for covid in intensive care in current waveinews"
"644","the corporate elite are pushing ahead with smart cities technofascist prisons in the face of the global covid…"
"645","as the covid pandemic continues its important to practice selfcare s covid coach app provides…"
"646","covid vaccination delays cost liveseditorial"
"647","the real story on the vaccine rollout is more complicated than youve heardhuffpostvia…"
"648","i had a cold for likedays and my body temp dipped to f but like it obviously wasnt covid and i have no idea how i got it"
"649","ok we get itthe covid vaccine is an injection in the armwe don’t need to seedifferent views on every broadcast"
"650","just in there is a sudden new rule requiring people traveling to gitmo to come with a negative results covid te…"
"651","questions about the covid vaccines join senior pastor bryan carter concord church today thursday january …"
"652","what’s the science behind this higher likelihood of getting covid betweenpm andam"
"653","hey that’s great but overpeople a day are dying from covid what good does this do…"
"654","leverage to get all progressive policies passed ma retroactivecovid relief and gnd most importantly"
"655","disneyland is officially getting rid of their annual passes due to covid"
"656","rear window but during covid and its me looking out the sliding glass door of my townhouse into the alley where se…"
"657","i really should be packing and figuring out how im gonna get to new york but the possibility i’ll test positive…"
"658","had to laugh at the called it comments because the pope got the cov…"
"659","new york wont tax forgivable ppp loans decides to comply with federal tax regulation that was adopt…"
"660","this probably should not come as any great surprise coviduk
covid"
"661","drafted to the lions
 injuries
 covid year"
"662","and just like thatthe election is over and covid disappears<U+0001F57A><U+0001F602><U+0001F602><U+0001F602>"
"663","what if covid took away your smell taste and you can’t see or hear fordays straight"
"664","im canadian where i live the maritimes has all but eradicated covid my province last had…"
"665","heres the regional covid breakdown from ab health for today jan
total activedown from 
ca…"
"666","i know what the covid is where it comes from i won a nobel peace prize for helping to determine it in mar…"
"667","according to the cdc website the usa is atmillion vaccinated with the first dose

we have a ways to go but i…"
"668","gotta pay for an app wait in line hoping the animal you wanted ain’t gone by the time you get appro…"
"669","residents and healthcare workers are concerned about covid surge in florida and sta…"
"670","saw this article and thought of you"
"671","humanity is mind blowing mixed with covid"
"672","both my grandparents have covid and my grandpa is in the hospital <U+0001F62C><U+0001F62C><U+0001F62C>"
"673","yeah people and places and stuff and unwanted hugging and touchingand sneezing without having to expla…"
"674","twdeathshooting 

white male mass shooters have not gotten the death penalty but black men who suffer from i…"
"675","this illness is simply not that severe for the vast majority of the population this doctor should nev…"
"676","nassau county is committed to an equitable distribution of the covid vaccine

the county is working closely wit…"
"677","how can you waste time in trivialities such as impeaching a president who is practical…"
"678","on the latest edition of theshow reactions to s recent postponements due to covid a…"
"679","the gop response see we told you sosocialism and deficits

joe biden just released histrillion covid re…"
"680","despite covid cases rising more colleges plan to reopen in the spring"
"681","we survived covid for this

lets fucking go"
"682","i agree keep getting e mails from my condo association were now up topeople testing positive…"
"683","tonightpm pstmalcontentment happy hour

 black coffee nw target of racism
 behind the pole with…"
"684","you truly don’t know what you’re talking about he had aapproval rating before c…"
"685","another covid crisis coming"
"686","heyloved the piece tonight on business pivotsplease talk to my best covid restructuring of a smal…"
"687","i wonder how covid is spreading in mainly muslim countries compared to non muslims ones like i wonder if the niq…"
"688","“this could be the next public health disaster in florida” said aron banks whose doralbased company cardiopath s…"
"689","onnews atgovjoinsin studio to discuss covid mitigation and vaccine distribu…"
"690","i have to take time off work unpaid because my husband is extremely clinically vulnerable ive had…"
"691","covid uks largest temporary morgue set to open with high deaths to continue for some weeksuk newssky n…"
"692","there are nowalbertans in hospital with covidof which are in icu anddeaths

the province com…"
"693","covid its real my nigerian brothers and sisters pls protect yourself use mask practice social distance take…"
"694","an inaguration closed to the public
covid killedtoday alone
vaccine distribution is worst in…"
"695","the headline makes it seem as though all k deaths are as a result of covid if you read it passively"
"696","for the recordas covid cases and deaths continue to climb in the us the pandemic of misin…"
"697","im all for that so long as scientific evidence supports these claims and teachers instructors and…"
"698","today we announced provincewide changes to restrictions around personal services and capacity limits on outdoor s…"
"699","guardian reporting today covid patients being transported as far as newcastle to receive treatment…"
"700","my colleague had positive covidi went on annual leavethe ser…"
"701","lloydminster’s home depot says despite having to work around the covid pandemic this year’s orange door campaig…"
"702","the washington post puts antiisrael narrative before covid vaccine facts"
"703","president elect joebiden announcestrillion covid proposal extratrillion for rd stimulus check …"
"704","biden’strillion covid relief bill will definitely help millions of americans in serious need this is the act of a real leader"
"705","to all returning residents welcome back and dont forget to get your covid test before moving back into your room after winter break"
"706","breaking world’s covid death toll exceededmillion"
"707","that was short term while shaving the covid beard this summer but she likes to bring out the picture ev…"
"708","two texas billionaires got amillion pandemic relief loan for one of their fracking companies but only after s…"
"709","lockdownlight does not work “manitoba had a higher rate than we did at the start of december and right now th…"
"710","still going to the grocery store with new virus variants spreading it’s probably time to stop"
"711","has anybody on here lost their tastesmell with covid i just wanna know when it’s gonna come back <U+0001F62D>"
"712","you already gotdollar checks also all those times you took a penny but didnt lesve one that was all covid r…"
"713","press release covid vaccine update for north central idaho"
"714","just in grand river transit is reporting another two covid cases both employees are bus operators and are now…"
"715","i hope she and the foundry returnthey both have a special place anf meaning in my heart

my grandfa…"
"716","its too bad but with luck after the initial postcovid disneyland rush theyll r…"
"717","out of pocket for covid test what happen to free testing"
"718","plan for covid no"
"719","if you passed first grade you w…"
"720","as the covid crisis in los angeles continues to put an incredible strain on local hospitals our team is delivering…"
"721","lets face ither treating of the help was cemented well before covid heyhow th…"
"722","happening nowsays firstemployees to start getting covid vaccineat broadbent arena h…"
"723","hate to break it to you q anon prats but donny hasnt arranged a d planet for you to ascend to drop dead fred ha…"
"724","for the recordas covid cases and deaths continue to climb in the us the pandemic of misinformat…"
"725","“currently frontline health care workers residents and staff at long term care facilities nursing homes assiste…"
"726","must be covid eating or maybe you’re depressed either way you are gross"
"727","i know twitter lives him but really the guy who unnecessarily drove hundreds of miles a day adding to our terrib…"
"728","covid has hit latino communities in california so hard that if i dont get it im going to feel like i lost some of my authenticity"
"729","this is the great reset the conspiracy theorists have been banging on about bidens inauguration will…"
"730","i wanna pet them so bad i wish there was no fucking covid and was rich id tour the country meeting…"
"731","graveside service setyearold covid victim"
"732","how early should you get to your covid vaccine appointment and are there toiletsmiami herald…"
"733","covid health care workers at high risk for mental health issues"
"734","stagetheatre news gerry cottle circus showman and wookey hole caves owner dies of covid agedcottle toured…"
"735","play the damn games or cancel the seasonno sense in postponing gamesthis is ridic…"
"736","israel the palestinians and the covid vaccines the new bloodlibel"
"737","covid pain too naturalconsequences"
"738","i want to remind albertans that sport rec amp fitness and restaurants have been closedrestricted since november …"
"739","i lived in california throughout this pandemicand didnt encounterperson in a year…"
"740","elders at indigenous retirement home in toronto receive covid vaccinecbc news"
"741","i miss axe throwing go cart racing and going to grab a mf drink wherever and whenever i want i’m mf tideeee of covid gt"
"742","the recorded death count from the covid pandemic is nearingmillion the true extent is far worse"
"743","how are they doing drag race with covid do they all get tested before or what"
"744","little harder with covid but if you’re willing to quarantine your first country it’s p…"
"745","like the most it was complications from covidhe had been hospitalized for a couple months"
"746","many wont like thisbut it is becoming crystal clear that the high priests of the covid cult must meet…"
"747","firstmillion in covid aid disbursed to minn businesses"
"748","can we finally admit that covid was used as a political tool for dems to destroy the presidentand that liberals…"
"749","five total cases of covid variants now in bcmy cariboo now"
"750","can’t wait for people to get their stimulus checks and start spending it <U+0001F44C>

joe biden just released histrilli…"
"751","covid got me asking my parents for permission to go places like i’myears old again i’myears old"
"752","some people are really out there playing chess with covid by going out everyday not keeping their distance and sti…"
"753","this should be interesting

porter seems of the type that would be laughing at drew for getting covid"
"754","its every where gop cowards bitch about covid staying home amp…"
"755","i dont normally praise a tory mp but fairplay to mr obrien for calling oututter coviddenying bulls…"
"756","postholiday covid surge hits new deadly recordsthehill"
"757","this tweet is the bat that caused covid x"
"758","covid brazilian variant sparks south america travel ban"
"759","how do the gov lawyers sleep at nightno realm of sanity to continue fightingopposing thismaybe if there…"
"760","we are loving this critifictional coursesyllabus from the year ” that imagines a syllabus for food pasts f…"
"761","for the recordas covid cases and deaths continue to climb in the us the pandemic of misi…"
"762","as democratics we must unite solely with president biden to get the agenda done for the a…"
"763","it is painful enough to deal with what many of us have lost from covid amp trumpplease warn us b…"
"764","things i did in this room while you were standing me

i started the logicg eazyjack harlow topic 

defended…"
"765","it’s not called “covid pandemic”

it’s called “<U+0001F449><U+0001F3FF>new<U+0001F448><U+0001F3FF> world order”"
"766","so happy my covid results came out negative <U+0001F44F><U+0001F3FC>"
"767","and with covid there was every “excuse” to show up with a mask 

but nope “masks are tyranny”"
"768","arizona auto glass replacement
cash back with windshield replacement
approved by all insurance com…"
"769","hi friend earnest question that i also asked the teacher from op what do you…"
"770","y’all really believeniggas died from covid inalready<U+0001F602><U+0001F602><U+0001F602>"
"771","the fact people think it is all hunky dory the mhra the independent gove…"
"772","vietnam had covid they eliminated it just like we did in nz"
"773","this tweet is bizarre for many reasons but mainly <U+2063>
<U+2063>
 i promise anyone who has experienced being houseless and…"
"774","lmaoooo as if covid was enough a new strain of bird flu is popping up united states is gonna drop the ball again w…"
"775","great figurestryare nothing to worry about thatis a very old person who is frail w…"
"776","yes kids need to learn socialize and develop no matter what else is going on their lives cant wait for age ap…"
"777","does anyone have the full list of artists that are blacked out now because ive lost count

regarding playing durin…"
"778","covid vaccination information can be found here"
"779","gonna try it when the vaccine for covid is improved and distributed cause i dont wanna risk getting covid…"
"780","just got my second covid vaccine a couple days ago i hope we get to point soon where we can get back to almost normal"
"781","very grateful for my opportunity to get the covid vaccine tomorrow <U+2728>"
"782","oxigenioparamanaus
covid eruption in brazils largest state leaves health workers begging for help"
"783","scariest thing is most of those without a single thought of how dire this covid situation is and the need to adhere…"
