"","x"
"266","jokes on you guys i’ve seen my mom giving herself the covid vaccine multiple times as a child"
"267","and they’re removing the use of an anesthetic when it’s argued covid could make the injection even more painful the…"
"268","sorry for no dbd this afternoon my mother amp step father were rushed to the hospital with covidboth placed in…"
"269","of total cases have fully recovered andof total cases have died the rest of the reported cases are sti…"
"270","the underlying dynamics that made the abnormality of college football during a global health crisis possible were…"
"271","staff member was contacted to self isolate after visiting woolies covid they tracked him down via his woolies rewards card"
"272","unfortunately the situation in america is completely different to australia covid wise 
it is what it is…"
"273","<U+0001F633><U+0001F30E>texas trauma surgeon says ‘postcovid lungs look worse than any type of"
"274","hardly anyone is using the covid tracer app something needs to change do your duty people"
"275","read article got to bottom copysend url and it’s a different article’s link
if you scroll slowly you’ll see url…"
"276","they can’t leave the bay area fast enoughthe new york times"
"277","covid cares about your reservation"
"278","the ons figures on deathswk show excess deaths about day above the …"
"279","my only living grandmother got the covid vaccine today"
"280","oregon daily covid cases at start ofweek pause


oregon daily covid cases afterweek paus…"
"281","sandrachris how was the first day of lockdown for you 
pour yourself a bottle of wine and enjoy this covid slo…"
"282","snuck through at peak of covid first wave"
"283","sorry your vaccine is poison it’s going to kill more people than covid i wouldn’t take it ever"
"284","like a true georgian when the body aches and chills from my second covid vaccine set in i took a goody powder cond…"
"285","a tornado blew our house away inini have been workinghour days to develop treatme…"
"286","daily telegraph rebuked over toby youngs covid column"
"287","have heard of five different instances of people being potentially exposed to covid in the lasthours including…"
"288","biden lays outtrillion covid relief package withstimulus checks"
"289","chicago and new york miraculously not caring about covid anymore and coincidentally wanting to open back up now"
"290","covid is still alive and welljust let him go on i would have laid his ass out tho"
"291","seven residents in quebec got coviddays after first vaccine dose guess first dose ffective"
"292","people died yesterday from covid in the uk<U+0001F494>"
"293","according to this"
"294","the number of people actively battling covid in bc fell for the fifth consecutive day to the lowest total sin…"
"295","roy died back in may of covid
rip"
"296","the only way russia is not winning the team event in skating if all there skaters have covid which is totally possible"
"297","alberta eases some covid restrictions"
"298","new research characteristics of covid patients based on the results of nucleic acid and specific antibodies and…"
"299","missing my flight because a covid clinic ghosted meis there anything i can do is a new top post on rlegalad…"
"300","my husband and son have always been amazed at how easy it is to go on vacation in a way it was m…"
"301","apparently the shooting doesn’t really start when the looting starts trump and his aides are looting the white ho…"
"302","for the recordas covid cases and deaths continue to climb in the us the pandemic of misinfor…"
"303","not a vaccineit’s an experimental therapy all candidates monitored until trial…"
"304","regulator refuses to approve mass daily covid testing at english schools"
"305","postcovid lungs worse than the worst smokers lungs surgeon says"
"306","ontario declares emergency amid surging covid cases as canada buys more vaccines"
"307","very good documentary on possible china covid coverup made by the bbc

satellite images around wuha…"
"308","oh brother our covid cases are through the roof no one isn’t trying to “take your guns”abbot is the worst"
"309","yay today i had my firstout of two covid vaccines i’ve never been so happy to have a shot"
"310","will let this one slide <U+0001F61C>"
"311","if you did there would be no chance of a trampoline didnt you know they are more dangerous than covid"
"312","we gotta get smarter about labels folks

masking pneumonia reality of the novel coronavirus allowed for hostile t…"
"313","he doesn’t have to give endlesshe is giving what usa hasn’tsee the other countries covid…"
"314","you can catch covid anywhere and still that’s no excuse to not stay home"
"315","these traitors also considered covid a hoax wonder how they feel about it now that prison a hot spot for covid looms"
"316","money should be no issue for government to procure covid vaccines experts say"
"317","how when didand thedevelop amp approve a new test to incorporate the new stra…"
"318","did something bad happen todaywell my buddy got covid but besides that no tellonym"
"319","like watching paint dry but at least the process is unfolding"
"320","years after covid is gone and i’m still gonna be like “sorry can’t go to your party i’m social distancing”"
"321","ini droppedlbsbig thing i learned there was how to eat well and in moderati…"
"322","m lives lost globally to covid terrible covid coronavirus"
"323","for sure i went through this with my grandfather as well last year but because covid kept me apart…"
"324","yes all while hessnowballing floridians that hes working sooo hard at dispensing covidvac…"
"325","wont the az significantly reduce viral load therefore lead to far less transmission do you think a zero co…"
"326","can employers require employees to get the covid vaccine can an employee refuse to return to work if his or her…"
"327","with the current climate trumpism has consumed all the excitement formillion who did not vote for him and aren…"
"328","professional and front line workers are the right people to put the world to rights regarding covid just listen to…"
"329","keep in mind once you preregister for the covid vaccine with aph the site might show that there are no vaccine…"
"330","i can’t believe i have to say this but thosedeaths are just covid deaths they…"
"331","trumps partner in allowing covid to run wild"
"332","read comments

they can’t leave the bay area fast enough"
"333","wondering what the bamlanivimab buzz is all about therecently authorized this new drug treatment for eme…"
"334","dont touch your face covid its out there"
"335","cnbc bidenstrillion covid relief plan calls for stimulus checks unemployment support and more…"
"336","you should lock the education dept shame on you destroy the future of students and could not make a c…"
"337","a year into the pandemic a big simple difference between china and the west is clear on average chinese people a…"
"338","lack of taste buds is a symptom of covid"
"339","until i know my appointment datetime for my covid test i’m staying in bed and playing minecraft and not talking t…"
"340","i cant believe i have to contend with covid deniers in this day of our lord january"
"341","shameful no mention bbc questiontime prioritygroups covid vaccination discussionthoserisk…"
"342","kid had an aches and pains one that knocked him for a week just before christmashis coworker who al…"
"343","dont worry this would mean the jobs would get offshore and no tax revenue for us fr…"
"344","back to reality amp i have so many things to do <U+0001F62F><U+0001F62F><U+0001F644> starting with yet another covid test for precaution"
"345","covidneedstrillion again this is how they mock you"
"346","one being in the covid board too extremely frustrating"
"347","wondering what the bamlanivimab buzz is all about therecently authorized this new drug treatment for eme…"
"348","player health amp well being was clearly the last thought on your thick corrupt brain if one single hi…"
"349","covid predominately kills old people 
most of the deaths are in long term ca…"
"350","covidcops mess with the wrong woman"
"351","seriously lol cuz its her job to make covid positive people stay home no that is between them and their doctors…"
"352","checked in forandin an occohio contestthe greyhounds who have…"
"353","anyone know if you can attend dsa meetings from home i mean in the era of covid they must be doi…"
"354","i’m tryna see sumn 
are you planning on getting the covid vaccine"
"355","for the recordas covid cases and deaths continue to climb in the us the pandemic of misinformati…"
"356","my best friend ofyears since college hockey he was a damn good goalie just died of covid i hate this fu…"
"357","covid brazil hospitals run out of oxygen for virus patientssmartnews"
"358","coworker came in monday amp tuesday sounding like death amp coughing after pleas from others in the office he was fina…"
"359","documentary on oneyear anniversary of taiwans fight against covid"
"360","you can get your covid test any time betweenam andpm in the pac concourse on friday jan"
"361","sign this petition to presidentelect biden asking him to issue an executive order banning evictions and utility sh…"
"362","and covid ignorance <U+270A><U+0001F3FE>"
"363","thread brazil is ranked number two in the world lists of covid fatalities behind the usa but that is almost cert…"
"364","you know what i misscentro before covid<U+0001F61E>"
"365","currently her role as sylvia llewelyn davies in finding neverland i am very much covid compromised…"
"366","covid"
"367","some of these ppl that work in thesefast food restaurants won’t get paid for being out with covid smfh that’s stupid af"
"368","rsa conferencegoes all virtual due to covid"
"369","covid isn’t a hoax people are dying shut up kyle"
"370","do u know how strong u gotta be to be study taking exams online support your grandparentsw c bombvery un…"
"371","from your lips to gods earif all victims of foxs intentionally false covid coverage sue they will go out of business"
"372","governor abbott the covid vaccine but for guns"
"373","prayers please i have been sick all year with pneumonia covid"
"374","rep adriano espaillat diagnosed with covid after getting vaccine"
"375","nasa keeps the stem lessons going from homeiste"
"376","cspcontest

i thought one of the best smiles is when we thanked in a pandemic called covid i drew the woman…"
"377","yikesi just moved to ut from the bay area and the lack of masks is astonishingi’m wondering if pe…"
"378","the ratio isnt nearly strong enough for this tweet but im here to do my part 
how about instead o…"
"379","avgdeaths covid per day once we have herd immunity we’ll everyone gets job back right back to gym back t…"
"380","covidtwelvety"
"381","due to covid protocols south carolina head coach frank martin will not be in attendance for lsus matchup satu…"
"382","took memonths to gain lbsthat is record breaking cause normally it would’ve taken meyearsso idk…"
"383","thousands of unnecessary deaths all for the purpose of perpetuating the covid hysteria through election day"
"384","clayton state indoor track and field season canceled over covid concerns"
"385","really what happened to k deathsday what happened to the nd wave what happened to q…"
"386","thats called the covid"
"387","antivaccine doctor joined attack on capitol"
"388","the maddening red tape facing older people who want the vaccine in new york its utterly impossible"
"389","gt incredibly relevant right now we mustn’t forget that those in hosp…"
"390","another case of not following science or statistics in handling this pandemic most of the lives lost are…"
"391","covid claire<U+0001F631><U+0001F631><U+0001F631>"
"392","<U+2066><U+2069> took mycovid shots tonight"
"393","it says if covid is included on the death certificate can u not read"
"394","for the recordas covid cases and deaths continue to climb in the us the pandemic of misinform…"
"395","you said there’s unused vaccine appointments for healthcare workers i work on a covid unit and have…"
"396","year old fitness influencer dmitriy died from covid he thought that covid did not existthen he got sick…"
"397","coronavirus updates biden to give speech on pandemic as daily death toll again exceeds"
"398","i don’t wanna get covid tho so it’s a no from me"
"399","correct we’ve got them getting things back to zero several times and maintaining restrictions and ot…"
"400","if i dont get an achievement unlocked didnt get covid once this pandemic is over im calling xbox"
"401","covid vaccine stocks that could trounce pfizer and moderna instocks nvax pfe mrna bntx…"
"402","alberta loosening covid gathering restrictions on mondaycovidab"
"403","biden has made clear that borrowers need relief especially during covid"
"404","good news the us is doing better than most of its peer countries at getting shots in arms

bad news there are…"
"405","my neighbor got covid <U+0001F627>"
"406","if you watch the mainstream media they will only tell you about covid deaths they wont tell you that as of jan…"
"407","in an alternative universepresident hillary clinton is being brought into congress to answer for the less than …"
"408","<U+0001F6A8>omafra has approved the allocation ofmillion in financial support to riding schools trail and therapeutic rid…"
"409","let me give u more then coloured hair best at beating covid most gl and bl produce then half of my fa…"
"410","trees can’t get covid omg lady watch apacolypse now later"
"411","politico biden’s heralded covid board has no idea what his plan is either"
"412","cz we don’t know what we are saying plus most pull this out oh president says this new thing is why can’t we cure…"
"413","according to south carolina head coach frank martin assistant coach chuck martin and doug edwards who handles s…"
"414","information on covid vaccine eligibility and availability is available on our site"
"415","everybody gets a covid coin from the gift shop"
"416","the problem with that is people like me that have had cov…"
"417","duhsantis needs to bring his sorry azz back to fl and figure out this clusterphuck h…"
"418","agreed on being inured to mass death

my entire thing is

 we’ve already had k deaths w…"
"419","yes but i can finally know peace i’m lowkey judging every single texas reporter on the covid beat…"
"420","i’m noti’m just telling u to chill with attack bcos u knew covid was out there but u were out jammin…"
"421","since yesterdayadditional children betweenenjoyed their first week in school by going to the hospital wi…"
"422","most pro life president ever but letpeople die from covidas a result of his attempted coup…"
"423","and not just because of covid i mean i’ve just become more anxious socially even if i’m with close friends i’ve known for years"
"424","yes nyc sue for your rights to catch covid 
eventually nobody will fucking be alive to even come out to eat but g…"
"425","and our percent positive covid rate is around"
"426","recovering from covid gives similar level of protection to vaccine"
"427","exactly but i think this needs to be a change not only for “right now” but for good one covid silver…"
"428","i remember when i shared my experience and y’all said i was paid to say i had covid <U+0001F97A> anyways that’s not importa…"
"429","plan to discharge covid patients to care homes in england is madness"
"430","one man too much powermitch stifled america with his personal agenda which is why trump not impeached…"
"431","yes americans have been getting a check from the government due to covid and everyones making jokes ab…"
"432","daily reminder to maskup and wash your hands unitedagainstflu

this years flu season is virtually nonexistent…"
"433","pogp course updatecovid education zoom"
"434","<U+262D>

the plan

keep on droppingto americans ostensibly for covid relief as a back door to establishing…"
"435","he really is i haven’t been able to meet him yet bc of covid restrictions but i can’t wait until i do"
"436","this was tricky but i have to go with disney because of all the people that went “waaaah i cant…"
"437","same tbh"
"438","i have been trying since well before christmas to get help with a warranty issue lg dont care blame it on covid t…"
"439","nobody will want to hear this new warning from dr faucismartnews"
"440","alberta loosening covid gathering restrictions on mondaycovidab"
"441","im extremely cautious regarding covid and…"
"442","china and covid the last dragon"
"443","it wont be for a while bc i am currently not working bc of covid and dont have much money but eventually"
"444","recall the hatred and bile of the left when trump got covidthe outpouring of hatred…"
"445","im more concerned we iowans have no idea how many doses of covid vaccine iowa has actually received <U+0001F914>

we als…"
"446","good jack needs to get rid of all the violent insurrectionary and covid disinformation peddlers"
"447","“hey grandad what did you do during the covid pandemic” 

“i did what i could but it was tough one night i s…"
"448","biden lays outtrillion covid relief package withstimulus checks"
"449","your talking in riddles here and then you’ve rubbished your entire point by m…"
"450","mayor mclean i wanted to thank you for all your efforts for covid containment and most re…"
"451","how is covid circulating if everything is shut down this is one reason so many employers doing minimal and halfhe…"
"452","for the recordas covid cases and deaths continue to climb in the us the pandemic of misinforma…"
"453","biden to unveiltrillion covid relief plan includingstimulus checks"
"454","governor scott ihave a question that concern me and others like me i amandmonths old with…"
"455","grey bruce health unit reportsactive covid cases"
"456","ian anytime someone posts a pic with their covid vaccine"
"457","new connect care bytes blog postingcovid and connect careaccessing public health act forms"
"458","the news that los angeles county lost a person from covid every six minutes would be almost one third of the nation…"
"459","me too and we are seeing as many concerts possible covid is not invited she’s so clingy <U+0001F614>"
"460","visa covid payment habits may be here to stay"
"461","covid"
"462","governor what are your thoughts on this frederick sheriff proudly proclaiming hes not following…"
"463","hospitalised patients with covid have compromised gut microbiomes study finds"
"464","someone needs to take that gavel away from nancy she would have never been reelected as speaker b…"
"465","i saw that article earlier this week i think it wasinpeople who get tested have covid regardless thats still crazy"
"466","if you have seen any therapists or counselors precovid check in with them its possible tha…"
"467","rd of la county had covid"
"468","well at least they came around to reality that’s so good it’s not about politics anymore…"
"469","arrested clubber tests positive to covid in police cell"
"470","at this point should we be looking for a vaccine for covid or for political pandering seems covid i…"
"471","yeah the pandemic numbers make feel weird like are we averaging close todeaths daily from covid…"
"472","learn how the openaccess nature of lexagenes miqlab system is designed to be rapidly configured to detect new…"
"473","i think if india manage to win or retain the gavaskarborder trophy this series it should be celebrated more than t…"
"474","communism cures covid you didn’t know"
"475","let’s absolutely turn to the science to protect ourselves from this train of covid in the us my dearest sym…"
"476","between purposely ignoring covid and fomenting sedition its probably best to avoid republicans for your own safety"
"477","total daily cases of covid in scotland as ofjanuarydata compiled by…"
"478","florida’s gas price rose toa gallon upcents from a month ago"
"479","allotments for this shipment of covid vaccine to aph has been filled we encour…"
"480","au contrairehes deleting all his old covid nonsense right nowand st…"
"481","covid is aboutdeaths away from surpassing world war ’s casualties and we’ll hit that next week at the rat…"
"482","takeaway avoid going into stores as much as possible <U+2705> and buy better masks todo

i know some of yall still…"
"483","because all it takes is one person to pass along covid wear your damn mask you have…"
"484","mind charity urge the government to act invest in community services and provide covid safe facetoface mental he…"
"485","the fact that my school wont let me have a teacher do i can learn if i want to stay doing online school is baffling…"
"486","you know that covid stuff is bullshit rightold kook in crocodile dundee inspired leather hat vest and socks…"
"487","thanks “fl man recovers from covid”"
"488","latest ny times newsletter brings up a lot of great points that has nothin…"
"489","instead of covid tests why dont they bring the covid vaccine vacc…"
"490","pssst does anyone out here want a quick covid jab"
"491","pcsos issued three covid fines tonight due to having reports of people visiting an address who should not have…"
"492","the man opened floridia full steam ahead and no covid precautions for the statecan…"
"493","well my family is in okc and it’s open with no mask mandates and my brother and sister both got co…"
"494","i dont believe the experts anymore they are contradicting each other on a daily basis earlier a nhs paramedic…"
"495","brilliant idea lauren onlyamericans currently die of covid every single hour of the day so who…"
"496","mlk day back home in small town souf florida be so lit but covid ol nasty ahh f’d it up<U+0001F612> i just wanted to get dressed and walk thru<U+0001F485><U+0001F3FE>"
"497","if you are looking for rapid rna covid test you can now book at 

first time in canada get…"
"498","japan is an island nation population twice the size of uk with…"
"499","army’s covid vaccine may hold key to beating coronavirus mutations"
"500","you are peddling dangerous misinformation and you need to stop this covid thing is serious"
"501","that’s absolutely not my point pre existing medical condition or not my understanding is they are at si…"
"502","some irish professor going viral about the vaccine killing people won’t help some info to counter…"
"503","faced with complaints about florida’s maddening system for distributing covidvaccines florida surgeon general dr…"
"504","presidentelect joe biden has a great covid relief plan"
"505","covid daystill in hospital day of antibiotics steroids amp slowly improving stats ive avoided icu as do…"
"506","covid is a whole other can of worms 

while we need national s…"
"507","no better time than now to tackle your first open source contribution ajuste no mobile"
"508","januarycovid test results record day deaths"
"509","reasons to start a business online given the changed reality that most of the globe has been facing over the rec…"
"510","alberta eases some covid restrictions"
"511","we are approaching the time when the peer reviewed and more meticulously done sarscovcovid research is emerging…"
"512","starting the th you’ll need a negative covid test to come back into the us"
"513","baltimore city schools expand inperson learning options starting febcbs baltimore"
"514","sir heath problems r in yr region ndp territory is big issue edm most covid cases mst in icuor…"
"515","alberta eases some covid restrictions"
"516","taking a covid test at home is weird because most of it is just sitting on a zoom call alone holding a tube of your own spit"
"517","active covid cases in bc fall to lowest total in almostweeks"
"518","the week exclusive chinese virologist dr limeng yan says covid viru<U+6765><U+81EA>"
"519","just in preselect biden is expected to detail his t relief package in a primetime address thursday—which wil…"
"520","optimal occupancy for a hospital isonly aboutof the active cases a…"
"521","are you serious my mother had covid and it got really scary how could you say that and encourage people not to very wrong"
"522","biden will make his case formore direct cash to americans an extension of and increase to supplemental empl…"
"523","days after contracting covid on placement my lateral test has come back as positive please be aware that the…"
"524","ahead of every other european nation in the covid death toll too well done"
"525","pandemic tech to help battle covid at cescnettechnie womenintech tech"
"526","brazil manaus in the heart of the amazon forest is a mess covid patients are dying suffocated in hospitals w…"
"527","providers throughout the world have now seen many cases of covid and know much more about how it affects pregn…"
"528","nobody minimising anything people dying of covid and lockdown is ruinin…"
"529","fabinho and keita didn’t start playing for us until atleast half way through the season whe…"
"530","retweeting someone elses tweets like this is just plain silly what do you mean by covid sceptics i…"
"531","one person dying everyminutes from covidtrump lied that this pandemic was a “democrat hoax”now we have…"
"532","schools college should remain closed because covid is on full rise and we cant risk our lives
closeschoolsnow…"
"533","dr tam supports vaccine dosage delay pfizer statement 
<U+274C>”safetyefficacy has not been evaluated on…"
"534","…"
